{
  "asset_id": "asset10_suiyi_zhifa",
  "asset_name": "六气岁宜治法库",
  "asset_description": "金·刘完素《素问病机气宜保命集·气宜论》录《内经》六气司天之政岁宜治法。六气司天各一条，为三因司天方背后的治则原文依据。仅作运气学理论参考，具体诊疗须遵医嘱。",
  "data_source": "金·刘完素《素问病机气宜保命集·气宜论第八》（公版古籍，daizhigev20 仓库 医藏/素问病机气宜保命集.txt L281-295）",
  "entry_count": 6,
  "entries": [
    {
      "sitian_key": "taiyang_hanshui_sitian",
      "sitian_name": "太阳寒水司天",
      "year_branches": "辰戌",
      "suiyi": "岁宜苦以燥之、温之。寒湿胜而阳微，故苦温燥湿以扶阳抑寒。方药方向请遵医嘱。",
      "yongre_yuanre": "太阳寒水司天，司寒之年用寒远寒；然寒淫所胜当以辛热平之，发表不远热，攻里不远寒，临证须辨证取舍。",
      "source_quote": "太阳司天之政（辰戌年）岁宜苦以燥之温之。",
      "source": "素问病机气宜保命集·气宜论"
    },
    {
      "sitian_key": "yangming_zaojin_sitian",
      "sitian_name": "阳明燥金司天",
      "year_branches": "卯酉",
      "suiyi": "宜以辛苦，汗之、清之、散之；又宜以咸。燥金胜而木郁，辛以散之、苦以清之、咸以软之。方药方向请遵医嘱。",
      "yongre_yuanre": "阳明燥金司天，燥胜则热化可知，用凉远凉、用温远温；然燥淫于内治以苦温佐以苦辛，发表不远热，攻里不远寒，临证须辨证取舍。",
      "source_quote": "阳明司天之政（卯酉年）宜以辛苦，汗之清之散之，又宜以咸。",
      "source": "素问病机气宜保命集·气宜论"
    },
    {
      "sitian_key": "shaoyang_xianghuo_sitian",
      "sitian_name": "少阳相火司天",
      "year_branches": "寅申",
      "suiyi": "岁宜以咸、宜辛、宜酸，渗之、泄之、渍之、发之。观气寒温，以调其过。火气胜则咸以软之、酸以收之、辛以散之，随气盛衰而调。方药方向请遵医嘱。",
      "yongre_yuanre": "少阳相火司天，司热之年用热远热；然火淫于内治以咸寒佐以甘苦，发表不远热、攻里不远寒为例外，临证须辨证取舍。",
      "source_quote": "少阳司天之政（寅申年）岁宜以咸宜辛宜酸，渗之泄之渍之发之。观气寒温，以调其过。",
      "source": "素问病机气宜保命集·气宜论"
    },
    {
      "sitian_key": "taiyin_shitu_sitian",
      "sitian_name": "太阴湿土司天",
      "year_branches": "丑未",
      "suiyi": "宜以苦燥之、温之。甚者发之、泄之。不发不泄，则湿气外溢，肉溃皮拆而水血交流。湿胜当苦温燥湿，甚则发汗宣越、渗泄利水。方药方向请遵医嘱。",
      "yongre_yuanre": "太阴湿土司天，湿气胜则当燥当化，用温远温、用寒远寒；然湿淫所胜平以苦热佐以酸辛，发表不远热、攻里不远寒，临证须辨证取舍。",
      "source_quote": "太阴司天之政（丑未年）宜以苦燥之温之。甚者发之泄之。不发不泄，则湿气外溢，肉溃皮拆而水血交流。",
      "source": "素问病机气宜保命集·气宜论"
    },
    {
      "sitian_key": "shaoyin_junhuo_sitian",
      "sitian_name": "少阴君火司天",
      "year_branches": "子午",
      "suiyi": "岁宜咸以软之，而调其上；甚则以苦发之，以酸收之。而安其下，甚则以苦泄之。君火胜则咸软苦发酸收，上下分调。方药方向请遵医嘱。",
      "yongre_yuanre": "少阴君火司天，司热之年用热远热；然热淫于内治以咸寒佐以甘苦、以酸收之、以苦发之，发表不远热、攻里不远寒为例外，临证须辨证取舍。",
      "source_quote": "少阴司天之政（子午年）岁宜咸以软之，而调其上。甚则以苦发之，以酸收之。而安其下，甚则以苦泄之。",
      "source": "素问病机气宜保命集·气宜论"
    },
    {
      "sitian_key": "jueyin_fengmu_sitian",
      "sitian_name": "厥阴风木司天",
      "year_branches": "巳亥",
      "suiyi": "岁宜辛以调上，以咸调下。必折其郁气，先资其化源。是以迎而夺之，王气之法也。风木胜则辛散调上、咸软调下，折郁气、资化源以迎而夺之。方药方向请遵医嘱。",
      "yongre_yuanre": "厥阴风木司天，风淫所胜当辛凉平之；用温远温、用热远热，然风淫于内治以辛凉佐以苦甘，发表不远热、攻里不远寒，临证须辨证取舍。",
      "source_quote": "厥阴司天之政（巳亥年）岁宜辛以调上，以咸调下。必折其郁气，先资其化源。是以迎而夺之，王气之法也。",
      "source": "素问病机气宜保命集·气宜论"
    }
  ]
}